{
  "titulo": "Flautisc0",
  "artista": "Francisco Alejandro Pérez Quinteros",
  "subtitulo": "",
  "descripcion_corta": "Flauta · Piccolo · Voz · Arreglo · Gestión Cultural",
  "fecha": "Santiago / Rancagua, Chile — 2026",
  "sinopsis": "Francisco Alejandro Pérez Quinteros es flautista, piccolista, tenor/barítono, arreglista y gestor cultural. Co-fundador y CEO de ATHA Producciones. Director de TinyPatio Concerts.",
  "propuesta_texto": "Propuesta artística integral: solista, dúo, ensemble, taller, masterclass o residencia.",
  "nota_direccion": "Propuesta artística orientada a crear experiencias cercanas, de alta densidad expresiva y rigor técnico. Cada concierto o taller es pensado como un objeto escénico coherente: repertorio, texto, espacio y público.",
  "requerimientos_texto": "Formato flexible según necesidades del espacio.",
  "requerimientos_detalle": "Repertorio de música clásica, contemporánea, jazz modular e industrias creativas.",
  "contacto_texto": "Coordinación: ATHA Producciones.",
  "cierre_texto": "Producción sostenible y reproducible con herramientas 100% open source.",
  "imagen_1": "https://drive.google.com/thumbnail?id=10CPr4Ywd2VnPl3GIfCBwK6ihflS6MS3n&sz=w2000",
  "imagen_2": null,
  "email": "",
  "web": "",
  "redes": ""
}