{
  "titulo": "Felipe Naranjo Manríquez — Actor, Director, Docente",
  "artista": "Felipe Naranjo Manríquez",
  "subtitulo": "Artes Escénicas · Teatro · Performance · Audiovisual · Radioteatro",
  "descripcion_corta": "Actor, director y docente de artes escénicas. Licenciado por la Universidad de Chile. Más de una década de trayectoria en teatro regional, dirección escénica y educación artística. Reconocido como Mejor Actor en los RG Awards del Teatro Regional Lucho Gatica (2024).",
  "fecha": "Santiago / Rancagua, Chile — 2026",
  "sinopsis": "Felipe Naranjo Manríquez es actor, director y docente de las artes escénicas. Formado en la Universidad de Chile, donde obtuvo su Licenciatura en Artes con mención en Actuación Teatral, lleva más de una década construyendo una carrera artística desde Rancagua hacia la región de O'Higgins y más allá. Su práctica abarca el teatro de sala, la performance patrimonial, el audiovisual, el radioteatro y la educación artística.",
  "propuesta_texto": "Propuesta artística integral: actuación teatral, dirección escénica, talleres de teatro y radioteatro, performances patrimoniales y guiaturas turístico-culturales.",
  "nota_direccion": "Cada proyecto es pensado como un objeto escénico coherente: repertorio, texto, espacio y público. La transmisión del oficio y el compromiso con el teatro regional son ejes transversales de su práctica.",
  "requerimientos_texto": "Formato flexible según necesidades del espacio: sala, espacio patrimonial, espacio abierto o formato híbrido.",
  "requerimientos_detalle": "Repertorio variable: Teatro de sala (La Vieja, El Oso, Musical Sewell), radioteatro (Kamikaze), performance patrimonial (Fundación Sewell), teatro infantil (ATHA Kids), títeres (El Principito).",
  "contacto_texto": "Contacto: pipe.naranjo33@gmail.com · +56 9 2378 9993 · ATHA Producciones",
  "cierre_texto": "Trayectoria reproducible, formación activa y compromiso con el teatro regional chileno.",
  "imagen_1": "https://drive.google.com/thumbnail?id=10CPr4Ywd2VnPl3GIfCBwK6ihflS6MS3n&sz=w2000",
  "imagen_2": null,
  "email": "pipe.naranjo33@gmail.com",
  "web": "",
  "redes": "\n\n*Generado por ATHAMU pipeline automático — fuente: Felipe_Naranjo_Manríquez.md*"
}
